rating,date,content
5,3달 전,"저녁 6시에 3 명이 물었습니다 😊
행렬 없음! ️ 럭키! ️ 1층 입구 스탭의 지시로 3층에 주문, 💰 지불 후 자리에 안내
현지 드라이버 씨 추천 마늘 효과 김치는 작게 잘라 먹기 쉬운 ❣️
내 주문한 두유 소면 🍜은 온화하고 먹기 쉬웠습니다 ❣️
찐만두도 깔끔하고 맛있었습니다 ❣️
명동에 오면 절대 가고 싶은 가게입니다 ❣️

대접까지 한 ❣️"
5,4달 전,"서울에 있는 동안 경험한 최고의 레스토랑 중 하나이며 잘 운영되는 레스토랑입니다. 우리가 이 미슐랭 스타 레스토랑에 대해 어떻게 알게 되었는지 기억이 나지 않으며 여기서 식사를 계획할 때 약간 겁이 났지만 경험은 굉장했습니다. 예상대로 입장 줄이 있었습니다. Google은 최소 60분의 대기 시간을 표시했지만 우리 중 2명은 15분 이내에 자리에 앉았습니다.
자리에 가까워지자 메뉴가 주어졌습니다(메뉴에는 4개 항목만 있고 우리는 이미 무엇을 주문할지 조사하고 알고 있었습니다). 직원이 주문을 받고 결제를 요청했습니다. 우리는 주문한 후 자리에 앉았고, 음식은 5분 안에 테이블로 배달되었습니다.
정말 훌륭했어요!.
아내는 만두를 먹었고 나는 손으로 자른 국수를 먹었습니다.
우리는 식사를 완전히 즐겼습니다.
맛, 서비스, 분위기가 세계적 수준이었기 때문에 그들이 수상한 수많은 상은 그럴 자격이 있습니다."
5,1달 전,"서울의 번화한 명동 지역에 위치한 명동교자는 편안한 닭육수에 손수 만든 칼국수를 맛보기 위해 꼭 방문해야 할 곳입니다. 면은 부드럽고 쫄깃한 식감을 갖고 있으며, 국물은 담백하면서도 풍미가 좋습니다. 만두(만두)도 인기가 높습니다. 껍질은 얇고 속은 돼지고기와 야채로 채워져 있습니다. 빠른 서비스로 유명한 이 4층짜리 레스토랑은 현지인과 관광객 모두에게 오랫동안 사랑받는 레스토랑입니다."
5,5달 전,"여러 미슐랭 상을 받은 놀라운 곳. 음료는 없고 음식만 4코스로 정리! 15분이면 나가요. 트레이까지 모든 오래된 스타일이 로봇에 도착합니다! 훌륭한 음식을 저녁 식사로 1인당 10유로를 지출했습니다! 매우 빠른 서비스, 잊을 수 없는 환경이지만 패키지의 일부입니다."
5,1달 전,아주 좋지만 소처럼 몰려드는 느낌이 듭니다. 그들은 당신이 조금 서둘러 들어가서 자리를 찾은 다음 웨이터에게 주문하고 음식 비용을 즉시 지불하도록 합니다. 결국 당신은 음식을 얻고 끝내기 위해 약간 서두르게 됩니다. 나갈 때는 들어왔던 문이 아닌 건물 뒤쪽에서 나가세요. 아주 이상한 경험 😅
4,5달 전,"저희는 시그니처 메뉴인 만두와 칼국수, 매운냉면을 먹어보았습니다!

만두는 적당량의 다진 돼지고기가 들어있어 괜찮았습니다. 피부가 더 얇았으면 좋겠지만! 3.5/5

칼국수면은 쫄깃쫄깃하고 쫄깃한 식감이 너무 좋았어요. 국물에도 연기가 났습니다. 4/5

다진 돼지고기를 얹은 매콤한 냉면이 정말 마음에 들었습니다! 참을 수 없을 만큼 매운 정도는 아니었는데, 열기가 확 올라오더라구요! 4/5

그들은 돌아다니며 테이블마다 김치를 담았습니다. 김치는 정말 맛있었어요. 매콤하고 GARLIC 맛이 가득했습니다! ❤️🤪

전반적으로, 이 지역 근처에 있다면 시도해 볼 가치가 있습니다."
4,3달 전,"이쪽도 6년만.

칼국수와 만두를 주문.

메뉴는 3개 밖에 없고 1인 원 주문제입니다. 아마 주스와 알코올도 없을 것 같다.

끊임없이 손님이 오고 있어 항상 만석 상태였다. 부드러운 맛이므로 매운 것이 서투른 분도 먹을 수 있습니다. 점원은 일본어 말할 수 있으므로 안심입니다."
3,1달 전,"당신이 대만 사람이라면

이 매장을 건너뛸 수 있습니다.

전 세계 사람들이 다 그 사람보다 맛있어

아니면 지펑 찐만두

뭔가 집밥같은 맛이 나네요

줄을 서서 기다리시면 빠르게 매장에 입장하실 수 있습니다.

테이블 회전율이 엄청 빠르기 때문에

좌석이 엄청 꽉 차있어요! ! !

식사가 나오기 전에 먼저 주문하고 결제하세요

속도가 너무 빨라서 겁이 날 수도 있고 아마도 돈을 지불하게 될 것입니다.

곧 일이 생길 거예요

음식 맛은 매우 주관적이지만 대만과 정말 비교됩니다

대만 만두 진짜 맛있어요

관광객들은 다른 음식을 먹기 위해 배를 열어 두는 것이 좋습니다"
5,5달 전,"빠르게 이동하는 긴 대기열. 우리는 5분만에 자리에 앉았습니다. 메뉴는 딱 4가지. 음식은 맛있었지만 서울에서 먹었던 대부분의 다른 식사와 비교하면 눈에 띄지는 않았습니다.
진정한 맛과 가격 대비 가치를 위해 방문할 가치가 있습니다."
3,3달 전,"명동의 소박한 이 곳의 국수는 단연 돋보이는 곳입니다. 국물, 만두, 김치는 괜찮지만 그냥 먹기에 좋습니다. 입장하기 위한 대기열은 빠르게 움직이고 서비스도 빠릅니다. 비록 경계선상 무례하긴 하지만요. 그러니... 국수를 먹으러 가세요. 제가 미슐랭 스타를 받은 이유가 바로 이것이라고 생각합니다. 매너/예의는 식사와 함께 제공되지 않는다는 점을 명심하세요(적어도 오늘 제 경우에는 그렇지 않습니다)."
4,2주 전,"대기열에 놀라지 마세요. 기다릴만한 가치가 있습니다.
레스토랑에는 앉기 전에 비용을 지불하는 3~4가지 요리만 있습니다. 그들은 모두 매우 훌륭하고 신속하게 서비스를 제공하므로 줄도 매우 빠릅니다.
상당히 저렴하고 기다릴만한 가치가 있습니다.

우리는 그것을 매우 좋아했고 요리는 큽니다.
7시 30분쯤 일찍 가면 줄이 거의 없습니다."
5,3주 전,"사람이 많은 곳은 이유가 있다!

우리 가족과 나는 만두와 칼국수 국수를 먹으며 훌륭한 식사를 했습니다. 직원은 매우 신속하고 5인 가족을 수용했습니다. 미리 비용을 지불하면 잠시 후 로봇이 음식을 테이블로 배달해 줍니다.

만두 속이 꽉 차 있었고, 국수 국물이 마음을 편안하게 해주었습니다. 훌륭한 미쉐린 빕 구르망 점심 식사를 위해 이 레스토랑을 추천합니다."
4,2달 전,대기열이 있지만 적어도 2인 그룹의 경우 빠르게 움직입니다. 국수는 훌륭하고 편안했으며 국수 만두는 맛있었습니다. 하지만 저는 냉면이 더 맛있었어요. 정말 상쾌했습니다. 만두피는 속이 넉넉하게 들어있어 맛이 꽤 괜찮았습니다.
5,3달 전,"국수와 만두를 먹기 좋은 곳! 메뉴에는 기본적으로 3~4개의 국수 요리와 만두가 포함된 몇 가지 항목만 있습니다. 손으로 찢은 국수와 만두(10인분)로 유명합니다. 커플이 오면 하나씩 사와서 나눠먹으면 된다. 당신이 안으로 들어가면 그들은 가득 차 있지 않은 테이블에 다른 사람들과 함께 있는 것을 포함하여 공간이 있는 어느 곳에나 문자 그대로 당신을 앉힐 것입니다. 신용카드로 결제하실 수 있지만, 주문과 동시에 결제하셔야 합니다. 식사를 마친 후 일어나서 나가시면 됩니다. 점심시간이나 저녁시간에는 줄이 너무 길기 때문에 가지 마세요. 이곳은 이유가 있어서 매우 인기 있는 장소입니다."
5,5달 전,"미쉐린 어워드 2017-2024

과대광고할 가치가 있나요? 세상에 그래!

항상 대기열이 있지만 꽤 빨리 진행됩니다.  문 바로 안쪽에는 주문할 수 있는 기계가 있는데, 그 규칙은 1인당 1접시입니다.  운 좋게도 메뉴에 요리가 4개밖에 없기 때문에 어려운 결정은 아닙니다. 일단 비용을 지불하고 티켓을 받으면 일행 규모에 따라 다른 층으로 지정됩니다.  3인 이상은 엘리베이터를 타고 3층이나 4층으로 올라갑니다. 1~2인은 계단을 이용해 2층으로 갑니다.

물도 제공되고 음식도 몇 분 안에 도착해요!  매우 빠르고 효율적입니다.  만두는 맛있었고, 쇼의 주인공은 칼각수였습니다.  김치가 포함되어 있으며 무제한입니다.

매우 합리적인 가격의 음식, 좋은 품질 및 만족스러운 이곳을 잘못 판단할 수 없습니다!"
5,3달 전,"최근 서울 여행의 첫날, 나는 미쉐린 가이드 레스토랑에서 아침 식사를 하며 모험을 시작했다. 내 친구와 나는 아침 일찍 도착했고, 열성적인 음식 애호가들의 긴 줄을 맞이했습니다. 처음에는 험난한 광경에도 불구하고 레스토랑의 내부는 놀라울 정도로 넓었고, 2층으로 되어 있고 많은 손님들을 수용할 수 있는 좌석이 넉넉했습니다.

우리 테이블은 맛있고 생생한 맛이 가득한 유쾌한 요리로 장식되었습니다. 명동 지역의 누구에게나 진심으로 추천하는 잊을 수 없는 요리 경험이었습니다. 근처에 머물든 그냥 지나치든 이 레스토랑은 음식을 사랑하는 사람이라면 꼭 방문해야 할 곳입니다."
5,4달 전,메뉴에 단 4가지 항목만 있고 모두 맛있는 놀라운 전통 레스토랑입니다. 이 서비스는 속도와 효율성 면에서 타의 추종을 불허하며 주문 후 1분 이내에 서비스를 받았습니다. 가격도 음식의 질과 양에 비해 엄청나게 저렴합니다. 그만한 가치가 있습니다.
4,3달 전,"저렴한 Bib Gourmand 미쉐린 레스토랑. 쉽게 자리를 잡았지만 모든 것이 매우 빠르게 진행됩니다. 또한 음식이 도착하기 전에 비용을 지불해야 합니다. 가파른 계단을 올라가야 합니다.
선택할 수 있는 요리는 수프 3개, 만두 1개, 총 4가지입니다. 우리는 칼국수(만두와 쇠고기 국물을 넣은 국수)와 만두(만두)를 먹었습니다. 수프는 좋았지 만 나를 날려 버리지 않았습니다. 제가 적극 추천할 수 있는 만두는 매우 맛있었습니다!
전체적으로 간단히 식사하기에 좋은 레스토랑이지만 꼭 방문해야 하는 것은 아닙니다."
4,3달 전,"항상 만석의 명동 만두.
미슐랭 ☆ 있음.
단지 위생문제에 어려움이 있어 한국보건소로부터 지도를 받아 벌금을 지불했다고 합니다.
맛은 담백한 고기 가득한 찐만두. 10개들이로 2명으로 반씩으로 정확히 좋다.
그리고는 인기도 칼국수. 일본 우동 같은 국수입니다.
달콤한 담백한 수프, 일본에서 인스턴트 같은 맛의 수프이지만, 어딘가 그리운 맛.
이것이 어째서인지 매우 인기이며, 칼국수만 먹고 있는 한 분도 많습니다.
그리고는 더운 시기에 좋다, 차가운 수프의 콩국스. 이것은 먹은 적이 없지만, ↩️ 노리고 있습니다.
나란히 있지만 회전이 빨리 거의 기다리지 않습니다.
일본어는 통하지 않지만 메뉴를 가리키고 This one으로 OK. 맥주를 마시고 싶습니다만, 맥주는 없기 때문에 물로."
5,5달 전,"어제 점심 먹으러 방문했습니다.
확실히 방문할 가치가 있고 짧은 기다림이 필요합니다. 주문하고, 결제하고, 음식을 테이블까지 매우 빠르게 배달받을 수 있습니다. 장소는 혼잡합니다. 하지만 식사는 맛있습니다. 특히 만두는 맛있습니다."
5,7달 전,"8년 연속 미쉐린 빕구르망 음식 추천 입니다 ♥
나는 한국 명동에 여러 번 가봤습니다.
명동 만두를 처음 먹어보고 싶네요.
최근 리뷰를 확인했는데 특별히 부정적인 점은 발견되지 않았습니다.
사용해 볼 수 있는 기회를 주기로 결정했습니다
이름에 걸맞는 맛이 정말 느껴지죠? !

🍴칼국수 (KRW 11,000/NT$250 약)
🍴만두찜 (KRW 12,000/NT$ 270 정도)
🍴한국 냉면 (KRW 11,000/NT$250 약)
🍴두유국수 (KRW 12,000/NT$270 정도)

명동만두찜은 10개 들어있어요
피부가 상당히 얇은 맛이 납니다.
안에 들어있는 고기도 느끼하지 않아요.
식감은 사이오마이 속을 채운 만두피에 가까운 느낌이에요.
맛있긴 한데 대만 사람들한테는
별로 놀랍지 않을 수도 있어요 😂

오이, 흰깨, 매콤한 소스를 곁들인 한국식 냉면
약간 매콤한 소스가 흡수된 차갑고 탄력 있는 면
식사가 끝날 무렵에는 매운 맛이 나고 뒷맛이 남는 것을 발견했습니다.
매운 음식을 좋아하고 먹을 수 있다면
시도해 볼 수 있습니다.

https://www.popdaily.com.tw/forum/korea/1502138"
4,7달 전,"★이런 사람에게 추천★
• 한국에 왔지만 매운 음식을 먹을 수 없다.
• 미슐랭 스타와 함께 가고 싶다.
• 국수를 좋아!

2024/6 방문

저녁에 도착했기 때문에 거의 기다리지 않고 입점.
3층 자리에 안내되어 계단으로 올라간다.
(엘리베이터도 있습니다)

선불 시스템.

만두는 10개들이.
나오는 것이 빠르다.

김치도 따라온다.

너무 맛있을 것 같고, 기세 좋게 먹지만, 탁상의 특제 소스를 놓쳐 버린다.

맛있다."
5,3달 전,"2024/4/14방점
명동으로 유명한 만두가게에 방점
껍질은 쫄깃하고 맛있고 맛있었습니다.
완탄라면도 만두와 같은 가죽이 사용되고 있어 떡으로 맛있었다
한국이라고 하면 김치이지만 여기까지의 가게에서 좀처럼 맛있는 김치를 만날 수 없었고, 여기 가게의 김치는 매우 맛있었습니다. 매운 맛이 상당히 강했지만 마늘의 맛이 잘 어울리고 맛있었습니다."
5,2주 전,층별로 다른 인원수가 배정됩니다. 2인용 좌석은 줄이 가장 긴 반면 4인용 좌석은 매우 빠르게 테이블을 차지했습니다. 만두 정말 맛있어요
5,2달 전,"여기 칼국수 국수는 😍😍😍 스모키한 국물 맛과 놀라운 국수였습니다. 딱 적당한 양으로 부드러워요.  정말 대단해요. 적극 권장합니다. 혼자 국수 먹으러 여기에 올 것입니다.

만두는 맛있었지만 내 마음을 사로잡은 것은 없었습니다.

먼저 주문하고 결제하시면 됩니다. 음식이 정말 빨리 나오네요. 점심 군중을 이기기 위해 일찍 오십시오!"
5,3달 전,"와, 여기 사람들이 음식에 얼마나 신경을 쓰는지 정말 아실 겁니다. 메뉴에는 4~5가지 요리만 포함되어 있으며 모두 합리적인 가격과 믿을 수 없을 만큼 빠른 서비스를 제공합니다. 훌륭한 경험! 만두와 오이를 곁들인 냉면이 정말 맛있었어요."
4,5달 전,미슐랭을 획득하고 있는 명동 만두의 본점.명동에 가면 반드시 들르고 싶은 가게의 하나입니다. 의 오더로 먹으면 나오는 스타일이므로 회전은 꽤 빠릅니다.
5,3달 전,"내 인생 최고의 수프와 만두. 정말 좋은 곳, 서울에서 꼭 방문해야 할 곳입니다. 줄이 있지만 정말 빠르게 움직이고, 메뉴에는 4가지 항목만 있고 음료는 없습니다. 현금을 미리 준비하세요. 너무 맛있어서 2주에 걸쳐 4번 방문했습니다."
4,3달 전,이곳의 명성에 비해 대기 시간이 길지 않을까 걱정했지만 결국 바로 자리에 앉았고 주문한 지 몇 분 만에 음식이 도착했습니다. 매우 효율적입니다. 칼국수와 얼큰한 냉면 둘 다 정말 맛있었어요. 서울에 있을 때 꼭 들러볼 가치가 있습니다.
5,4달 전,"우리는 8월 말 주중 점심 먹으러 그곳에 갔었습니다.
대기시간도 없고 정말 맛있어요
나는 닭고기 국물(양파, 국수, 라비올리)을 먹었습니다. 정말 맛있고, 맛이 많아요.
우리는 빨리 서비스를 받았고, 가게 분위기도 “20분 안에 먹고 나가자” 정도였지만, 우리 쪽에서는 45분 동안 아무 문제 없이 머물렀다.
나는 추천합니다(그러나 미쉐린도 있으므로 잘못 갈 수는 없습니다)."
4,3달 전,"⭐︎24/9에 방문했습니다
・메뉴는 심플하게 4점만으로, 주류는 없습니다.
・서비스나 분위기의 장점이라고 하는 부분에서는 특별히 아무것도 없습니다만, 가격이 싼 일과 회전의 장점으로부터⭐︎4개로 하고 있습니다!

【행렬이 서투른 분에게】
요리 제공이 빠르고, 좌석 수가 많기 때문에 꽤 회전이 빠릅니다.
인기 가게이기 때문에 다소의 행렬은 항상 있는 전제는 됩니다만, 겨우 10분 정도 줄서 보면 어떻습니까?
꽤 진행한다고 생각하기 때문에, 진행 상태를 근거로 판단되어도 좋을까 생각합니다!"
5,4달 전,"손칼국수와 만두국도 맛있지만 냉면도 맛있으니까 다른 사람이랑 같이 먹어야지! 사람마다 다른 요리를 받아서 나눠먹을 수 있어요! 요청하시면 밥과 국수를 더 가져다 드립니다.
또한 필요한 만큼 김치를 리필해 드립니다."
5,2달 전,"서울 명동 만두 본점은 미쉐린이 추천할 정도로 인기가 많을 뿐만 아니라... 명동 만두는 줄이 긴 경우가 많습니다. 매장 내 메뉴는 1.칼국수, 2.만두, 3가지 뿐입니다. 두유국수와 4. 김치냉면! 해가 지나도 그 맛은 변하지 않습니다. 명동칼국수의 원조로 진한 국물의 국수와 만두가 유명합니다! 미쉐린 빕 구르망이 몇 년 연속 추천한 간편식은 정말 인상적이에요."
4,2달 전,"이 미슐랭 빕 구르망 레스토랑의 믿을 수 없을 만큼 좋은 음식. 국물이 진하고 고소하고 맛있었어요. 국수는 씹을 때 미끄러웠어요. 만두는 불법적으로 맛있었습니다. 우리가 저녁 늦게 도착했기 때문에 서비스와 분위기가 최고는 아니었고, 자리에 앉았지만 가능한 한 빨리 나가기를 원했습니다. 구글에서는 오후 9시에 문을 닫는다고 하는데 LAST ORDER는 8시 30분입니다! 그래서 많은 사람들이 돌아섰습니다!"
4,2달 전,"어쨌든 나란히 있었습니다. 한국어를 모르기 때문에, 나란히 있으면 갑자기 다른 곳으로 유도되었습니다.
뒤의 엘리베이터로 돌고 3층에 갈 수 있을까?
주문하고 10 초 정도로 나와 깜짝!
메뉴는 벽에 붙어 있습니다.
만두 부탁하면 먹을 수 없을 정도로 배가 팽창했습니다!"
5,2달 전,"명동교자(명동교자)는 1966년부터 가족이 운영하고 있는 곳입니다. 이 레스토랑은 만두와 국수 전문점으로 메뉴가 4가지밖에 없습니다. 그들의 만두는 속이 꽉 차 있고 정말 맛있습니다. 인기 있는 손칼국수 요리인 칼국수도 이곳의 특산품 중 하나입니다. 4월부터 10월 사이에 이 지역을 방문한다면 매운 국수는 꼭 먹어봐야 할 메뉴입니다. 매운맛과 감칠맛이 완벽하게 균형을 이루고 있습니다.

항상 줄이 있지만 꽤 빨리 움직입니다. 음식도 정말 빨리 나오네요. 주문할 때 지불해야합니다."
4,1달 전,"만두가 맛있다.우동은 느긋하게 맛있지 않지만, 수프는 좋은 맛."
5,3달 전,"명동 올 때마다 김치 땡기면, 찾는 곳.
국수랑 작은 간이 잘 밴 김치.

저는 한국인이고 명동에 올 때마다 가장 좋아하는 곳이에요. 매우 인기가 많은 레스토랑입니다. 음식이 빨리 나오고, 맛도 평준화된다. 김치는 매콤해서 국수와 잘 어울려요.

[ 팁, 면, 밥은 1회 무료 ] ❗️
국물에 밥을 넣고 김치와 함께 먹으면 아주 맛있습니다."
5,2달 전,"명동교자
유튜브에서 보고 드디어 가보았습니다
국물이 진짜 맛있네요
면도 리필 무료고
밥도 1회 무료입니다
만두랑 같이 먹었는데
전 리필 안해도 배불렸어요
만두의 고기향이 특이해서 맛있어요
나중에 비빔국수도 먹어보고 싶네요

Youtube에서보고 나서 마침내 먹어 보았습니다.
국물은 매우 맛있었습니다.
국수 대신 무료
쌀도 한 번 무료입니다.
만두와 함께 먹었다.
대신 없이 배고프고
만두의 고기 향기가 특이하고 맛있었습니다.
나중에 비빈도 먹고 싶습니다."
5,4달 전,"이 곳은 미슐랭 스타를 받을 자격이 충분히 있는 곳입니다. 몇 가지 항목만 포함된 간단한 메뉴가 아주 잘 완성되었습니다. 칼국수와 만두는 반드시 주문해야 하며, 매운 국수와 차가운 콩국수는 배가 든든하다면 시도해 볼 가치가 있습니다. 레스토랑은 항상 붐비므로 줄을 서서 기다려야 하지만 기다릴 가치가 있습니다!!"
4,5달 전,"메인 스트리트의 한쪽 동쪽에 있습니다. 한자 표기이므로 찾기 쉽습니다.
평일 11시 정도 가면 기다리지 않고 3층으로 안내되었습니다. 계단입니다.
메뉴 자체는 몇 점 밖에 없고, 점원이 결정할 때까지 떠나지 않으므로 즉결해 주세요. 칼국수와 만두의 주문입니다.
구글 렌즈로 번역하면 국수 한잔에 대해 밥 한잔 무료라고 쓰고 있습니다. 부족한 분은 부디. 착석 한 명당 반드시 면의 주문도 하지 않으면 안 되는 것 같습니다. 규칙은 다국어로 부탁하고 싶은 곳입니다.
몇 분만에 요리는 나옵니다만, 상상의… 라고 말할까 베타인 칼국수(조개의 깔끔한 계)와는 다릅니다. 조개 없음, 고기. 그래도 코테리가 아닙니다. 양도 적당히 있습니다. 보통 맛있습니다. 만두는 둥글고 이미지로 하면 小籠包에 가깝고 6개가 아니라 10개입니다. 이쪽도 구이가 아니라 찜입니다. 조금 맛이 얇을까 ...하지만 맛있습니다.
먹고 끝날 무렵에는 행렬이…
일찍 가서 여유롭게 들어가는 것을 추천합니다."
5,2달 전,"명동 지역에 계시다면, 목록에 꼭 포함되어야 할 한 레스토랑은 동네 최고의 교자를 제공하는 것으로 유명합니다. 현지인과 관광객 모두가 꼭 방문해야 할 명소입니다. 이곳의 교자는 완벽하게 손질된 섬세한 포장지 안에 고소한 고기와 야채가 듬뿍 들어있습니다. 씹을 때마다 부드러운 속살과 쫄깃한 겉면 사이에 풍미가 가득합니다.

하지만 이곳을 특별하게 만드는 것은 만두 뿐만이 아닙니다. 그들의 시그니처 칼컷 국수는 만두의 풍부함을 보완하는 가볍고 편안한 국물과 함께 제공됩니다."
4,3달 전,"음식은 나쁘지 않습니다.. 좋지만 훌륭하지는 않습니다. 평소와 같은 서비스는 친절하지 않습니다(우리 마을과 다릅니다).
음식은 4가지 선택이 있고, 각 메인 코스를 하나씩 주문해야 합니다."
5,3달 전,"와 이게 바로 이 리뷰가 작성된 2017년부터 2024년까지 미슐랭 스타를 받은 이유입니다 🤓
만두와 칼국수 전문점인데 요즘 국과 튀기지 않은 음식을 더 좋아하기 때문에 이곳이 제가 가장 좋아할 수 있는 곳이라는 걸 알게 됐어요 ☺️
만두도 너무 맛있고, 김치도 정말 맛있고, 다른 식당에서 먹어본 김치와는 달랐어요.
1인당 최소 1개의 요리를 주문해야 하므로 공유할 수 없다는 점을 명심하세요🤭
괜찮습니다. 다음 방문에는 만두와 국수를 꼭 주문하겠습니다 🙂"
5,5달 전,간판 메뉴의 만두와 칼국수를 주문. 수프는 담백하게 마시기 쉽습니다. 양이 많기 때문에 혼자 먹는다면 칼국수 일품으로 충분히 배가 가득합니다.
5,2달 전,"찐만두도 냉면도 맛있어요
김치는 마늘향이 나고 향긋하며 매콤해요."
5,7달 전,"메뉴는 국수 3종류와 만두의 심플한 내용입니다. . 메뉴가 곧 가지고 가 버렸는데도 어쩌면 그 밖에도 많이 메뉴 있을지도 모릅니다.
만두와 국수와 녹색 국수의 비빈 국수를 먹고 감격했습니다."
5,9달 전,"이번이 두 번째 방문입니다. 저는 제철 냉면 두유를 먹어보지 못했습니다. 이번에 드디어 먹어보게 되었는데, 굉장히 두껍고 좋네요.

선택할 수 있는 요리는 4가지뿐입니다. 대기 직원은 앉자마자 주문하고 즉시 결제하기를 기대합니다. 음식은 주문하자마자 바로 나오므로 배가 고프면 딱 좋습니다.

슈퍼마늘과 매콤한 김치가 모든 사람에게 어울리는 것은 아니지만, 만두찜과 정말 잘 어울립니다.

미쉐린 빕 구르망이라는 명성에 걸맞는 곳입니다."
5,4달 전,좋은 국수! 만두가 국수보다 더 맛있으니 꼭 주문하세요! 우리는 바쁜 시간에 가서 매우 혼잡했지만 좌석이 많으니 걱정하지 마세요. 그러나 상황이 다소 급할 수 있으며 웨이터는 음식이 제공되기 전에도 비용을 지불하도록 요청할 것입니다.
4,4달 전,면이 너무 부드러울 것 같은데 국물도 맛있고 웍맛도 나네요! 만두피가 얇고 고기도 듬뿍 들어있어서 나쁘지 않네요! 김치가 엄청 매워요! 만두와 딱!
5,3주 전,"1인당 한 가지 요리를 주문해야 하며, 음식을 나눠 먹을 수는 없습니다. 미쉐린 레스토랑답게 맛이 좋고, 만두 한 개 가격은 NT$350 정도입니다."
