rating,date,content
4,3년 전,"제가 갓 20살이 되었을 때, 안방처럼 드나들던 명동에 올때마다 꼭 먹었던 것이 명동교자였는데요.. 최근에 영자언니가 방송에서 언급한 이후로 죽어가고있는 명동의 상권을 다시 일으키고 있다는 (?) 설이 돌 정도로 웨이팅이 어마무시하다고해서 마음 단디 먹고 갔는데 다행히 기다리지 않고 바로 입장했어요(머쓱). 옛날이나 지금이나 직원분들의 빨리빨리~!! 는 변함이 없네요. 앉자마자 1)주문하고 2)계산하고 3)바로 음식나오고 ㅋㅋㅋ 방금 무친듯한 마늘 가득 김치는 국수랑 찰떡이고 맛도 그대로 변함이 없어요."
4,6년 전,"개인적으로는 약간 짜장면맛칼국수..? 이런걸불맛이라고하나..?? 완전 내스타일ㅋㅋ
1인1국수해야 사리무제한이고 만두는속이꽉찼음ㅎ
다만 선불에 사람들로초만원이라 구석에앉으면 직원부르기어려움.. 편한사람과가세여ㅋㅋㅋ"
4,5년 전,"일요일 저녁 5시경 명동 나왔다가 5식구가 명동교자 본점에 들렸다.
1층에 만석이어서 엘리베이터 로 3층에서 먹었다.교자 칼국수가 소고기가 많이 들어있는데 9000원이다.
맛도 좋았고 사람이 정말 많었다."
3,5년 전,"신속, 정확...맛도 그대로.
대신 추억만 가득할뿐 편한 식사장소는 아니죠.
한달에 3번이상, 1년에 최소 20번은 가는것 같은데
여행객들에겐 인기있는 오래된 전통의 명물 식당이지만
이 지역이 근무처인 사람에게는
조금만 늦음 한참을 계단줄을 서서 기다리는
황당함이 있는곳이지요.
식사주문과 함께 계산을 같이 하고, 디저트 사탕까지 함께주는 곳.
식사회전이 엄청 빠른데 뭐 그렇다고 먹다 체할 정도는 아니구요.
다만 명동왔음 명동교자는 들러서 칼국수, 만두는 먹어봐야하는거 아니냐 하심 꼭 드셔보시구요.
두번, 세번째 명동 왔을때는 더 운치있고, 맛난곳에서
편하게 식사와 시간을 보내셔도 될것 같습니다."
4,5일 전,"미슐랭을 가지고 있다고 듣고 기뻤던 가게.
기대했던 것 이상으로 맛있었습니다!
다른 요리도 맛있었습니다 만, 만두가 역시 1 번이었습니다 (^^)

행렬이 되어 있었지만 비교적 빨리 자리에 도착할 수 있었다.
입점시에 메뉴를 기계로 주문해, 자리에 붙자마자 요리가 로봇으로 옮겨져 왔다!
메뉴 수 좁혀 있기 때문에 제공도 빠르고, 손님의 회전도 빠르다."
5,1달 전,"명동만두는 한국의 인기 있는 만두 전문점으로 많은 사람들에게 사랑받고 있습니다. 특히 야채와 고기의 맛이 제대로 느껴지는 것이 매력입니다.

점내의 분위기도 활기가 있어, 스탭도 친절합니다.바쁜 시간대에는 혼잡하는 일도 있습니다만, 그만큼, 타이밍을 일의 사이에 견해해, 꼭 방문해 보세요.

또, 명동 만두에서는, 한국의 전통적인 요리와의 편성도 즐길 수 있으므로, 다양한 맛을 즐길 수 있는 것이 기쁜 포인트입니다. 가게입니다."
5,1주 전,"이 위치의 정확한 위치는 여기에 없습니다. L7호텔과 세종호텔을 따라 메인 스트리트로 이전하였습니다.

패스트푸드로 간주됩니다. 음식을 받기 전에 결제를 하면 2~3분 안에 음식이 배달됩니다. 때로는 웨이트리스나 로봇에 의해.

면은 잘 삶아져서 여러 그릇을 미리 삶아도 너무 눅눅해지지 않습니다. 만두가 너무 맛있어요! 두 세트를 먹을 수 있는 여유가 있었으면 좋겠어요. 나는 다시 돌아올 것이다."
5,4주 전,"밖에서 보면 한 푼도 안 줄 텐데 안으로 들어갔어요. 작은 계단이 위층으로 연결됩니다. 한국인만요. 그들은 나에게 메뉴를 가져왔습니다. (종이에) 세 가지 요리 중에서 선택할 수 있습니다. 기다리고 기다려도 웨이터가 다가오지 않아서 손을 흔들면 바로 오셔서 주문을 하고, 한국말로 뭐라고 욕하시는 것 같은 말을 하십니다. 잠시 침묵이 흐르고 그는 돈을 지불하겠다고 손짓합니다. 나는 그것에 대해 조금 기분이 좋지 않습니다. ""여기서 외국인을 보고 선불금을 요구하는 것 같다""고 생각합니다.
직접 만든 만두와 라면을 주문합니다. 지금까지 먹어본 라비올리 중 최고. 감칠맛이 나는 국물에 푹 담근 라면!  그래서 앙코르를 주문하는 동안 줄을 서 있는 많은 사람들을 관찰하는 시간을 갖게 되었고, 테이블은 비어가고 금새 채워지고, 선불이 정상이고 나에게 비난처럼 보였던 것은 다름 아닌 정상적인 악센트였다는 것을 이해합니다. 혀의. 그 곳이 그대로 남아서 외국인들의 왕래가 거의 없었으면 좋겠습니다."
5,1달 전,"음식은 맛있었고 메뉴는 매우 제한적이었지만 음식은 훌륭했습니다. 국물은 너무 맛있고 마음이 따뜻해졌으며 깊이가 좋았고 국수는 탱탱하고 부드러웠습니다. 저는 개인적으로 만두를 정말 좋아했는데, 그건 어차피 만두를 평생 사랑했기 때문일 수도 있습니다. 육즙이 너무 많고 얇은 껍질과 풍미 가득한 속, 참기름 소스가 어우러져 향긋하고 풍미를 한층 더해 주는 것이 마음에 들었습니다. 김치가 듬뿍 들어간 냉면도 정말 사랑스럽고 상큼하면서도 든든한 한끼였습니다. 서비스는 매우 빠르고 효율적이었고 우리는 30분 이내에 그곳을 드나들 수 있었습니다."
5,1달 전,"미쉐린을 받은 레스토랑인데, 음식이 정말 훌륭해요. 메뉴는 딱 4가지에요. 주목할만한 맛으로 가득 찬 간단한 음식. 장소는 바쁘지만 서비스는 효율적이고 빠릅니다. 아래층에 주문기가 있어요. 각 음식마다 다른 색상의 티켓을 주문하고 지불하고 얻을 수 있습니다. 직원이 자리로 안내해 주며, 주문한 음식은 5분도 안 되어 도착합니다. 사이드 김치는 무제한입니다. 서울에 있을 때 특별한 필수품입니다."
4,2주 전,"아래는 영어

명동 지역에서는 칼국수와 만두가 유명한 곳입니다.
식당은 사람이 많고 식사시간에는 줄이 꽤 길지만 대기시간도 빨라서 15분 정도 기다려서 테이블이 잡혔습니다.
가격도 적당하고 면과 만두 모두 맛있고 입맛에 딱 맞습니다.
개요는 경험해야합니다!

…
명동에 있는 이 식당은 칼국수와 만두가 유명한 곳입니다.
사람도 많고 식사시간에도 줄이 길지만 대기시간은 짧아서 15분 정도만 기다렸어요.
가격도 적당하고 국수와 만두의 맛도 괜찮습니다.
전반적으로 시도해 볼 가치가 있습니다!"
4,2주 전,"염원의 명동만두🥟
여행으로 서울에 왔을 때는 언제나 가게 앞에 만들어진 장뱀의 줄에 무서워 들어간 적이 없었던 가게.
이번에는 오픈과 동시에 가서 나란히 입점할 수 있었다!
쫄깃한 국수의 칼국수와 껍질이 얇고 구이 가득한 만두(한국판 만두), 삐릿과 매운 김치.
이것은 명동 갈 때마다 가고 싶어진다.

※명동 만두는 먼저 회계 시스템이므로 주의하십시오 :)"
3,1주 전,"요약 3/5: 평균적인 음식, 패스트푸드 스타일 레스토랑. 음식이 제공되기 전에 결제하고 카드 결제도 가능합니다.

음식 3.5/5: 보통.
1. 더 교자(찐만두) 3.5/5: 만두는 중국식 만두와 비슷해서 딘타이펑 만두가 생각나는 맛이었습니다. 단지 크기가 더 크고 안에 국물이 들어 있지 않다는 것뿐입니다. 즉, 제 생각에는 미쉐린 등급이 아닙니다.
2. 콩국수 3/5: 콩국수는 진하고 짠맛과 단맛이 느껴지고 참깨 맛이 나서 풍미가 좋습니다. 국수는 아주 작은 오이 조각(거의 보이지 않음)이 들어 있는 녹색 소바와 같고 평범하고 간단한 채식 요리입니다. 큰 부분 크기. 미쉐린 등급도 아닙니다.

서비스 3/5: 이 Michelin Bid Gourmand 레스토랑은 많은 관광객을 끌어 모으고 있습니다. 우리가 여기에 왔을 때 우리는 1층 정문에서 줄을 서기 시작했습니다. 즉, 군중/교통 통제를 위해 입구에 직원 스테이션이 있어 대기 시간이 짧습니다. 4가지 요리만 제공되기 때문에 음식을 만드는 것도 매우 빠르게 제공됩니다.

환경 3/5: 매우 바쁜 레스토랑이므로 낯선 사람들과 테이블을 공유해야 합니다. 흥미로운 부분은 낯선 두 사람이 테이블을 공유하는 경우 사이에 나무 칸막이를 놓는 것입니다. 우리에게는 처음입니다."
5,3주 전,너무 우스꽝스럽고 사람이 너무 많습니다. 다행스럽게도 줄을서는 사람의 수는 미쉐린 추천과 동일합니다. 차가운 음식 2 개와 뜨거운 음식 2 개만 선택하는 것이 좋습니다. 그냥 뜨거운 면과 만두를 선택하세요. 가장 맛있는 것은 피클입니다. 저와 함께 손을 들고 큰 소리로 외쳐보세요. 누구세요?
5,1달 전,"우동이겠지요?라고 생각했지만, 정말로 맛있었습니다! 보고 시행착오하고 있었지만, 점점 진짜 맛을 잊어 왔다…."
5,2달 전,우리는 저녁시간에 방문했는데 운이 좋게도 바로 자리에 앉을 수 있었다. 우리가 갔을 땐 이미 줄이 엄청 길었어요. 장소는 더 깨끗할 수 있지만 직원은 매우 효율적입니다. 국수는 훌륭하지만 남은 음식(국수)은 집으로 가져갈 수 없으므로 주문할 부분에 주의하세요. 음식이 제공되기 전에 먼저 비용을 지불해야 하므로 시간 낭비를 피하기 위해 방문하기 전에 메뉴를 검토하는 것이 가장 좋습니다.
4,3달 전,"한국에 갈 때마다 반드시 먹고 싶어지는 맛.
항상 혼잡하지만 타이밍에 따라 나란히 넣는 일도 있습니다.

혼잡해도 회전이 빠르고 좌석수도 많아 인원수에 의해 안내되는 플로어를 나누고 있는 느낌이 듭니다.

자리에 안내되는 직전 바로 회계였으므로 메뉴를 생각해 두는 것이 좋습니다. 회계를 마치고 자리에 도착하면 몇 분도 하지 않고 요리가 옮겨져 왔습니다.

매회 칼국수와 만두를 부탁하지만 안정의 맛. 만두는 점유율이 좋다고 생각합니다.

마늘 효과가 있는 김치. 나에게는 신맛 있고 너무 힘들기 때문에 혼자서 먹는 것은 약하다. 칼국수에 넣고 맛변시킨 후 쪽이 먹기 쉬웠다."
5,3달 전,"완전 맛있어요!! 서울로 5일간 여행을 떠났는데 이것이 우리 여행 일정의 처음이자 마지막이었습니다. 우리는 메뉴의 4개 항목 중 3개를 시도했는데 제가 가장 좋아하는 것은 만두와 차가운 매운 국수였습니다. 심지어 김치도 맛있어요! 서비스가 빨라서 회전율도 빠르고 두 번 방문했을 때에도 줄을 설 필요가 없었습니다. 가격도 매우 합리적입니다. 매우 간단한 직원 및 프로세스, 주문-결제-먹기. 차가운 물을 제외하고는 다른 음료를 이용할 수 없습니다. 나는 신경 쓰지 않았고 빠른 회전율에 도움이 되었습니다. 반드시 시도해야 합니다."
5,3달 전,"아주 잘 조리된 전형적인 한국 요리 4가지만 제공하는 곳입니다. 대기 시간이 매우 길고, 입장하는 데 최소 30분이 소요되며, 공간이 매우 작고 테이블을 공유하는 경우가 많습니다.
음료수는 필요 없고 물만 있으면 됩니다.
전형적인 것을 시험해 볼 수 있는 추천 장소이며, 4가지 요리를 제외한 나머지 요리는 매우 실망스럽습니다."
5,2달 전,"4가지 메뉴를 제공하는 미쉐린 가이드 레스토랑(여름철에만 간장 국수 제공) 칼국수는 정말 진정 효과가 있었고 깨끗하지만 풍미 가득한 국물을 가지고 있었습니다. 만두도 맛있고 김치도 정말 맛있었어요.

식사 시간(최소 15분) 동안 줄을 서고 앉기 전에 주문할 준비를 하십시오. 음식이 15초 안에 도착합니다
웨이터가 미친 듯이 레스토랑에 가능한 한 빨리 들어오고 나갈 수 있도록 해주기 때문에 차분한 식사나 좋은 서비스를 기대하지 마세요. 줄이 짧으면 맛있는 식사지만 30분 이상은 기다리지 않을 것 같아요"
3,2달 전,"2인이 한 접시만 가져가면 못 먹습니다. 사람이 많고, 1층에 자리가 있는데도 3층까지 올라가서 먹게 됩니다.

편집: 저는 3명과 함께 돌아왔는데, 정상적으로 치료를 받으려면 4명이 필요한 것 같습니다. 교자가 좋기 때문에 안타깝습니다. 다만, 식당에 사람이 많아 시끄럽습니다."
3,2달 전,"레스토랑 외부는 올해 2024년을 포함해 지난 몇 년 동안 미쉐린이 인정한 간판으로 덮여 있다. 메뉴는 국수, 건면, 만두 3가지 뿐이다. 혼자 여행할 땐 낭비를 피하기 위해 국수 한 그릇밖에 주문할 수 없었는데 국수는 Q자 모양이고 국물은 찐하고 위에 올려진 다진 고기는 아주 맛있고 곁들여진 김치도 아주 매콤했어요. 국수에 넣어 국물을 더욱 겹겹이 만들었습니다. 하지만 기대가 클수록 실망도 커진다고 해야 할까요. 이 국수는 평범하다고 ​​생각조차 하지 않았습니다."
4,5달 전,"명동만두 명동교자 명동에는 2 개의 음식점이 있습니다.
식사는 딱 4가지 종류만 있어요
칼국수, 찐만두, 국수, 두유국수
본점은 명동역 8번출구에서 더 가깝습니다.
명동관광정보센터에서 가장 가까운 1호점

장소: 명동 만두집
주소: 서울시 중구 명동10길 29
교통 : 지하철 4호선 명동역 8번출구 도보 3분, 한차오 지도
영업시간: 10:30~21:00(월~일), 춘절 및 중추절 기간 휴무

민동 만두 메뉴에 라면은 꼭 먹어봐야 할 메뉴라고 들었어요.
하지만 내 생각엔 괜찮을 것 같아
저는 폭탄면을 더 좋아해요 ꕀ
면도 면이 내 입맛엔 너무 부드럽다
그런데 닭뼈를 듬뿍 넣어 만든 국물이 꽤 맛있네요.
다진 고기, 양파, 버섯, 애호박 등의 재료를 넣고 볶습니다
맛은 달콤하고 강하고 독특한 향이 납니다.
지금까지 한국 음식이 훌륭하다는 것을 알게 된 곳이기도 합니다.
'국물양념'과 '소스'가 모두 독특해요⟢
맛있는 음식의 비결ꕀ

알고보니 만두집이었는데 만두를 더 추가해야겠어요⟢
불평하는 부정적인 리뷰가 많이 있지만
하지만 결국 남의 말만 듣는 것은 공평하지 않은 것 같습니다.
말할 권리를 갖기 전에 직접 시도해 보아야 합니다.

만두는 우리 샤오롱바오랑 좀 비슷해요⟢
실제로 꽤 좋지만 놀랍지는 않습니다.
소스에 찍어먹으면 또 달라져요
전체 업그레이드

그런데 맛있는 대만 만두를 먹었어요
한국 만두는 개인적으로 괜찮아요.

개인적으로 국수는 정말 맛있는 것 같아요⟢⟢
음식이 나오자마자 A'Zhu의 어머니가 면을 자르는 것을 도와줄 것입니다.
한국 국수는 정말 맛있습니다.
너무 좋아요 ꕀ ˊ̱˂˃ˋ̱
아직까지 나쁜 맛을 본 적은 없어요⟢
이 국수는 달콤하고 매콤하며 걸쭉한 맛이 나요⟢
먹으면 먹을수록 입에서 매콤해지는 맛이 나요.ᐟ
정말 맛있게 먹네요.ᐟ
내 마음을 사로잡으세요⺣̤̬ .ᐟ

전반적으로 꽤 좋은 것 같아요.
실제로 한국에 왔어요
가격이 너무 착해요ꕀ
쇼핑하다 지치면 쉬면서 식사하는 것도 좋아요."
4,1달 전,7시 30분에 저녁 식사를 기다릴 필요가 없습니다. 만두는 껍질이 얇고 지방과 살코기가 적당하게 들어있어 맛있습니다. 면발도 맛있지만 면발이 너무 부드럽고 쫄깃쫄깃하고 김치도 맛있습니다. 자리도 많고 장사가 아주 잘 되더라구요.
4,3달 전,"혼자 방문입니다. 주말의 저녁 식사 시간대라고 하는 것도의 몹시 혼잡했습니다만, 좌석수가 많기 때문에 회전도 빨리, 거의 줄지 않고 착석할 수 있었습니다. 2인용의 작은 테이블에 충격을 세우는 상석이었습니다. 2~3품은 어떻게든 둘 수 있습니다만, 그 이상은 무리한 넓이입니다.

내가 들었을 때는 늘어선 때에 건네받은 메뉴를 보고 주문을 결정해, 착석전에 청산까지 끝내고 나서라고 하는 흐름으로, 착석 후 몇 분으로 배선. 가게 안의 분위기에 걸린 곳은 없고, 식당이라는 분위기이므로, 데이트에는 적합하지 않을 것입니다 (웃음).

만두(만두)는 10개 단위이므로 혼자 다른 사람과 함께 부탁하면 먹는 것이 힘들다(나는 남겼습니다). 국수와 함께 주문하는 것이 좋습니다. 나는 비빈 냉면과 함께. 가격도 저렴, 맛은 오랜 인기 가게만있어 틀림 없습니다."
5,1달 전,"대사관에 환전하러 간 뒤, 가는 길에 장갑과 ​​모자도 샀습니다. 가게는 눈에 띄지 않는 것 같은데 위층에는 사람이 너무 많아요. 저는 시그니처 칼국수를 주문했는데, 부드럽고 돼지고기 국수 맛이 났습니다. 만두는 정말 찐 만두인데 맛있고, 명동에 오면 꼭 먹어봐야 할 만두입니다.

24,000원
#맛있는만두
#명동음식"
5,4주 전,"MYEONGDONG KYOJA 명동교자 본점 - MICHELIN GUIDE RESTAURANT instagram🥟🍜🏆⭐️

명동교자 명동교자는 1966년부터 가족이 운영하는 곳입니다. 이 레스토랑은 메뉴에 4가지 항목만 제공하며 만두와 칼국수를 전문으로 합니다.

풍부한 역사를 자랑하는 이 식당은 미슐랭 빕 구르망에 선정된 이후 더욱 유명해졌습니다.

사내에서 직접 만든 시그니처 마늘이 듬뿍 들어간 김치를 포함해 따끈따끈한 교자를 맛보기 위해 매일 수많은 고객이 이곳으로 모여듭니다.

줄을 서서 구불구불하게 늘어서 있는 것은 위협적일 수 있지만 빠르게 움직이고 장소가 항상 윙윙거려 활기를 더해 편안한 음식을 위한 분위기 있는 식사 핫스팟이 됩니다.

칼국수 국수는 맛있었다. 국물이 아주 담백하면서도 맛이 좋았고 국물에 고기의 훈제 향이 느껴졌다. 손으로 자른 면발은 부드럽고 미끄러웠으며, 씹히는 양이 적당했습니다.

만두피는 크기가 넉넉하고 육즙이 가득 들어있습니다. 얇은 껍질은 반투명에 가까웠고 약간 큼직한 샤오롱바오 같았는데 가장 기억에 남는 건 고기의 양이었던 것 같아요.

Ps: 주소: 이 유명한 레스토랑은 실제로 명동 중심부에 2개의 매장이 있습니다(따라서 한 곳의 줄이 길면 언제든지 다른 곳을 방문할 수 있습니다. 두 곳은 매우 가깝습니다!)

* 서울시 중구 명동10길 8
* 서울시 중구 명동10길 29"
4,4달 전,"명동교자 본점 명동교자 본점

이 한식당은 메뉴가 4개 있는데, 2층부터 식당 앞까지 사람들이 길게 줄을 서 있는데, 줄이 엄청 빠르다. 너무 오래 기다리지 말고 3가지를 주문해 보세요.

잘게 썬 국수: 얇은 만두 5개에 돼지고기를 채운 부드러운 국수입니다. 수프는 은은한 향이 나고 맛이 괜찮습니다.
만두 : 샤오롱바오처럼 맛도 좋고 크기도 크다
콩국수: 이 요리에는 녹색 국수가 들어있습니다. 서빙할 때면을 잘라주십니다. 국물은 된장을 섞은 것입니다. 저는 이 그릇을 좋아해요. 한 번도 먹어본 적이 없어서 이상해요.

#이 가게는 맛있어요."
5,2달 전,"돼지고기 만두와 매운 냉면을 제공하는 매우 좋은 레스토랑입니다.

우리는 자리에 앉아 이용 가능한 3가지 요리 중에서 주문하고 미리 비용을 지불하면 요리가 테이블에 즉시 도착합니다.

초고속 서비스, 많은 사람들이 줄을 서서 기다리고 있습니다. 빠른 테이블 회전.

라비올리는 훌륭합니다!"
5,1달 전,"미쉐린으로 유명한 명동 맛집. 밖에는 항상 줄이 있지만 매우 빠르게 이동합니다. 레스토랑 자체가 매우 빠르게 움직이기 때문입니다. 2층에도 테이블이 많이 있어요. 직원은 주문 전체를 명확하게 설명할 필요도 없습니다. 중간에 주문을 받고, 기계에 넣고, 결제를 위해 카드를 가져가면, 짜잔! 너무 빨라서 웃기네요😅

음식은 맛있습니다. 지금까지 칼국수(특정 피라미드 모양의 만두가 들어간 만두), 비빔국수, 만두를 먹어봤는데 다 맛있었어요. 맵지 않아서 누구에게나 안전합니다(하지만 김치는 맵습니다).

여름에 콩국수 먹으러 또 갈게요.

칼국수와 만두에는 고기가 들어있습니다. 비빔국수와 콩국수에는 고기가 없습니다."
5,1달 전,훌륭한 음식. 나는 15년 전에 그녀를 왔고 품질은 좋아졌지만 더 좋아졌습니다. 세 가지 요리 중 하나만 선택할 수 있는 경우에는 항상 좋은 선택입니다. 매워서 먹고 싶지만 데울 때 딱 좋은 단맛의 조화입니다.
1,2주 전,싱가포르인의 관점에서 말씀드리겠습니다. 음식은 조금 실망스럽습니다. 특별하거나 맛이 있는 것은 없습니다. 어느 정도는 약간 혼합되어 있습니다. 만두 채우기가 너무 간단해요. 칼국수 국물은 밋밋합니다. 그들은 모두가 무언가 한 그릇을 주문해야 합니다. 면이 꽤 푸짐하니 면을 나눠 드세요.
5,2달 전,"서울에 올 때마다 꼭 가는 맛집이에요! 국수와 만두는 정말이 세상에서 벗어났습니다! 내가 의미하는 바를 정말로 이해하려면 맛을 봐야합니다.
시원하고 매콤한 녹색면이 정말정말 맛있어요😋"
4,4달 전,매우 인기 있고 바쁜 곳. 칼국수는 훌륭하고 김치도 무제한으로 제공됩니다. 내가 이상하게 생각한 점은 우리가 자리에 앉기 위해 줄을 서서 기다리는 동안 주문을 요청받고 바로 그 자리에서 요금이 청구된다는 것입니다. 유입되는 고객을 관리하기 위해 이렇게 하는 것 같지만 전체 식사 경험이 약간 긴장됩니다. 그래도 훌륭한 음식! :)
5,2달 전,"맛있고 풍부한 미쉐린 표준 음식.
레스토랑은 명동 산책로에 바로 위치해 있어 찾기가 매우 쉽습니다. 레스토랑 입점은 2024년까지 미쉐린 타이틀 연속이다.
서비스 직원은 빠르고 열정적이므로 너무 오래 기다릴 필요가 없습니다. 가격은 좀 높지만 맛은 맛있고 한번 먹어볼 가치가 있습니다.
레스토랑 공간은 그리 넓지 않지만 좌석이 좁지는 않습니다.
김치는 아주 맛있고 향이 좋으며 마늘이 많이 들어있습니다."
5,7달 전,"2017년부터 2024년까지 미쉐린 어워드를 수상했습니다.

정말 그렇게 좋은가요?

네 그렇습니다 !!

우리는 Knife Cut Soup Noodles에 놀랐습니다. 풍부한 국물, 쫄깃한 식감, 신선한 재료.

만두는 집에서 먹는 맛이 나더군요. 맛있고 자연스러운 충전재.

이 미쉐린 레스토랑에는 4가지 요리만 있지만 모두 맛있습니다!

냉면과 매운 국수는 약간의 맛이 있지만 시도해 볼 가치가 있습니다!

서비스는 매우 빠르고 완벽합니다.
일본라면 가게와 유사한 자동 판매기 티켓을 통해 주문합니다.

서울을 방문하는 모든 방문객이 꼭 들러야 할 맛집입니다."
3,2달 전,아버지의 추천으로 가족식사로 방문했습니다.  우리 모두는 닭고기 국물 수프와 만두를 먹었습니다.  수프와 만두는 훌륭했습니다.  면이 미지근해서 좀 더 따뜻하게 끓여줬으면 좋았을 텐데요.  마늘이 첨가된 것으로 알려진 김치는 서비스를 제공하지 않습니다. 단지 좋지 않습니다.  나는 이 곳이 미쉐린 등급을 받을 가치가 있다고 생각하지 않습니다.
5,1달 전,"이곳은 서울의 중심(명동)에서 매우 유명하고 바쁘고 맛있는 곳입니다
하지만 아무리 유명하고 미슐랭 스타를 받았음에도 불구하고 수입은 매우 빠릅니다.

메뉴는 딱 4가지에요.

주문할 때 테이블에서 결제하시면 됩니다.

김치와 물이 무료로 제공됩니다.

빨리 먹고 나가면 사교할 수 있는 곳이 아니다.

라면과 만두를 먹어봤는데 다 맛있었어요."
5,3달 전,"추석의 기간에 오후 2시에 두 사람이 가서 터무니없는 행렬이었기 때문에 한순간 그만두려고 생각했는데, 이것 또한 있을 수 없는 속도로 회전하고 순식간에 자리에 도착할 수 있다 네.
착석과 동시에 메뉴로 주문하고, 현금으로 선불. (카드도 사용할 수 있습니까?)

마늘이 온 스프의 칼국수와 반대로 담백한 만두로 맛있게 받았습니다!
배가 너무 많아서 많은 명동 포장마차는 아무것도 손을 뗄 수 없었습니다. . ."
